"witness_id","case_id","name","statement"
"1","1","Henry Carter","Saw a man running away from the scene."
"2","null","Lisa Perez","Heard loud noises but did not see anyone."
"3","3","Ethan White","Identified the suspect in a lineup."
"4","4","Grace Nelson","Noticed the suspect entering the bank."
"5","null","Dylan Baker","Gave a vague description of the suspect."
"6","6","Olivia Rivera","Saw the suspect holding a weapon."
"7","7","Noah Carter","Heard the suspect bragging about the crime."
"8","8","Emma Lopez","Recognized the missing child from a photo."
