"news_id","title","content","published_date"
"1","Tech Stocks Rally","Technology stocks surge after strong earnings reports.","2024-02-19"
"2","Federal Reserve Policy","Interest rate decisions impact market trends.","2024-02-18"
"3","Tesla Unveils New Model","Tesla announces new electric vehicle for mass market.","2024-02-17"
"4","Amazon Growth","Amazon reports record-breaking holiday sales.","2024-02-16"
"5","NVIDIA Hits New Highs","Chipmaker sees strong demand for AI processors.","2024-02-15"
"6","Google AI Breakthrough","Alphabet reveals advancements in AI technology.","2024-02-14"
"7","Meta’s VR Expansion","Meta expands virtual reality offerings.","2024-02-13"
"8","Johnson & Johnson Dividend","Healthcare giant announces increased dividend payout.","2024-02-12"
