"analysis_id","resume_id","job_id","match_score","ai_summary","analyzed_at"
"1","1","1","88.50","Strong in Python and ML, meets job criteria.","2025-04-08 02:52:19"
"2","2","2","91.00","Excellent Java backend skills, fits perfectly.","2025-04-08 02:52:19"
"3","3","3","75.00","Good with Excel and Python, lacks visualization tools.","2025-04-08 02:52:19"
"4","4","4","82.30","Strong front-end experience, matches UI role.","2025-04-08 02:52:19"
"5","5","5","89.10","DevOps tools match well, solid experience.","2025-04-08 02:52:19"
"6","6","6","93.00","Excellent planning and agile background.","2025-04-08 02:52:19"
